<?xml version="1.0" encoding="UTF-8"?>
<!DOCTYPE pr SYSTEM "pr.dtd">
<pr>
    <header>
        <key_name>Project Record - TP4</key_name>
        <title>Trabalho Pratico 4</title>
        <bdate>05 Novembro 2020</bdate>
        <edate>08 Novembro 2020</edate>
        <supervisor url="http://www4.di.uminho.pt/~jcr/">
            José Carlos Ramalho</supervisor>
    </header>
    <workteam>
        <elem num="A83930">
            <name>Luis Miguel Arieira Ramos</name>
            <mail>a83930@alunos.uminho.pt</mail>
        </elem>
    </workteam>
    <abstract>
        <p>Este <b>TPC4</b> consistiu na criação de um servidor em <i>node</i> de modo a receber pedidos e a responder aos mesmos.</p>
    </abstract>
    <deliverables>
        <link url=""></link>
    </deliverables>
</pr>